{
  "schema_version": "company-universe-v1",
  "generated_at": "2026-07-13T00:00:00+09:00",
  "description": "Seed universe for ModularHub steel modular competitor analysis. Unverified metrics are intentionally null or empty.",
  "companies": [
    {
      "schema_version": "company-master-v1",
      "company_id": "yuchang-enc",
      "company_name": "유창이앤씨",
      "company_name_en": "YooChang",
      "aliases": [
        "유창이앤씨",
        "유창E&C",
        "Yuchang E&C"
      ],
      "country_code": "KR",
      "company_type": "specialist_manufacturer",
      "competitive_role": "direct_competitor",
      "analysis_tier": "tier_1",
      "business_status": null,
      "modular_methods": [],
      "target_markets": [],
      "headquarters": null,
      "website_url": "https://yoochangenc.com/",
      "listed_market": null,
      "ticker": null,
      "summary": "Official website identity and URL are confirmed; source-backed modular production, project, bidding, technology, and financial details remain under research.",
      "last_verified_at": "2026-07-14T00:00:00+09:00",
      "data_confidence": "low",
      "review_status": "collecting",
      "company_profile": {
        "modular_business_started_year": null,
        "business_status": null,
        "scope": {
          "design": "not_confirmed",
          "engineering": "not_confirmed",
          "module_manufacturing": "not_confirmed",
          "material_procurement": "not_confirmed",
          "transportation": "not_confirmed",
          "lifting": "not_confirmed",
          "site_installation": "not_confirmed",
          "general_construction": "not_confirmed",
          "maintenance": "not_confirmed",
          "rental": "not_confirmed",
          "operation": "not_confirmed"
        }
      },
      "production": [
        {
          "facility_id": "yuchang-enc-yoochang-factory",
          "facility_name": "YOOCHANG E&C Factory",
          "facility_aliases": [
            "유창이앤씨 Factory"
          ],
          "facility_type": "modular_factory",
          "own_facility_status": "confirmed_own_facility",
          "ownership_type": "company_operated_factory_claimed_by_official_site",
          "operation_status": "current_operation_unconfirmed",
          "country": "KR",
          "region": null,
          "city": null,
          "address": null,
          "site_area_m2": 60427.8,
          "building_area_m2": 25832,
          "production_scope": [
            "steel_modular_factory"
          ],
          "structural_systems": [
            "steel_modular"
          ],
          "main_equipment": [],
          "line_count": null,
          "reported_capacity": null,
          "capacity_value": null,
          "capacity_unit": null,
          "capacity_period": null,
          "capacity_basis": "not_publicly_disclosed",
          "capacity_as_of": null,
          "source_ids": [
            "yc_official_home"
          ],
          "verified_at": "2026-07-14",
          "confidence": "medium",
          "verification_note": "Facility name and site/building areas are taken from the official website Factory section; current operating status and capacity are not independently disclosed."
        }
      ],
      "project_portfolio": [],
      "bidding_performance": [],
      "technology": {
        "structural_systems": [],
        "connection_technologies": [],
        "fire_resistance_certifications": [],
        "seismic_technologies": [],
        "highrise_track_record": null,
        "new_construction_technologies": [],
        "patents": [],
        "innovative_procurement_products": [],
        "factory_completion_rate": null
      },
      "financials": [
        {
          "year": 2025,
          "scope": "separate",
          "reporting_scope": "separate",
          "accounting_standard": "general_korean_gaap",
          "currency": "KRW",
          "modular_segment_available": false,
          "modular_segment_revenue": null,
          "source_ids": [
            "dart-00144960-20260408002280"
          ],
          "verified_at": "2026-07-14T06:54:16.041613+00:00",
          "confidence": "high",
          "total_assets": {
            "source_value": 270984904156,
            "source_unit": "KRW",
            "normalized_value": 270984.904,
            "normalized_unit": "KRW_MILLION",
            "normalization_factor": 1e-06,
            "account_name": "자      산      총      계",
            "receipt_number": "20260408002280",
            "extraction_method": "audit_report_xml_acode",
            "verification_status": "extracted",
            "fiscal_year": 2025,
            "reporting_scope": "separate",
            "source_ids": [
              "dart-00144960-20260408002280"
            ],
            "confidence": "high"
          },
          "total_liabilities": {
            "source_value": 200386015125,
            "source_unit": "KRW",
            "normalized_value": 200386.015,
            "normalized_unit": "KRW_MILLION",
            "normalization_factor": 1e-06,
            "account_name": "부      채      총      계",
            "receipt_number": "20260408002280",
            "extraction_method": "audit_report_xml_acode",
            "verification_status": "extracted",
            "fiscal_year": 2025,
            "reporting_scope": "separate",
            "source_ids": [
              "dart-00144960-20260408002280"
            ],
            "confidence": "high"
          },
          "total_equity": {
            "source_value": 70598889031,
            "source_unit": "KRW",
            "normalized_value": 70598.889,
            "normalized_unit": "KRW_MILLION",
            "normalization_factor": 1e-06,
            "account_name": "자      본      총      계",
            "receipt_number": "20260408002280",
            "extraction_method": "audit_report_xml_acode",
            "verification_status": "extracted",
            "fiscal_year": 2025,
            "reporting_scope": "separate",
            "source_ids": [
              "dart-00144960-20260408002280"
            ],
            "confidence": "high"
          },
          "revenue": {
            "source_value": 307684467052,
            "source_unit": "KRW",
            "normalized_value": 307684.467,
            "normalized_unit": "KRW_MILLION",
            "normalization_factor": 1e-06,
            "account_name": "Ⅰ. 매출액(주석19,20)",
            "receipt_number": "20260408002280",
            "extraction_method": "audit_report_xml_acode",
            "verification_status": "extracted",
            "fiscal_year": 2025,
            "reporting_scope": "separate",
            "source_ids": [
              "dart-00144960-20260408002280"
            ],
            "confidence": "high"
          },
          "cost_of_sales": {
            "source_value": 274344857861,
            "source_unit": "KRW",
            "normalized_value": 274344.858,
            "normalized_unit": "KRW_MILLION",
            "normalization_factor": 1e-06,
            "account_name": "Ⅱ. 매출원가(주석19,20,21)",
            "receipt_number": "20260408002280",
            "extraction_method": "audit_report_xml_acode",
            "verification_status": "extracted",
            "fiscal_year": 2025,
            "reporting_scope": "separate",
            "source_ids": [
              "dart-00144960-20260408002280"
            ],
            "confidence": "high"
          },
          "gross_profit": {
            "source_value": 33339609191,
            "source_unit": "KRW",
            "normalized_value": 33339.609,
            "normalized_unit": "KRW_MILLION",
            "normalization_factor": 1e-06,
            "account_name": "Ⅲ. 매출총이익",
            "receipt_number": "20260408002280",
            "extraction_method": "audit_report_xml_acode",
            "verification_status": "extracted",
            "fiscal_year": 2025,
            "reporting_scope": "separate",
            "source_ids": [
              "dart-00144960-20260408002280"
            ],
            "confidence": "high"
          },
          "operating_profit": {
            "source_value": 14867615594,
            "source_unit": "KRW",
            "normalized_value": 14867.616,
            "normalized_unit": "KRW_MILLION",
            "normalization_factor": 1e-06,
            "account_name": "Ⅴ. 영업이익",
            "receipt_number": "20260408002280",
            "extraction_method": "audit_report_xml_acode",
            "verification_status": "extracted",
            "fiscal_year": 2025,
            "reporting_scope": "separate",
            "source_ids": [
              "dart-00144960-20260408002280"
            ],
            "confidence": "high"
          },
          "net_income": {
            "source_value": 5662989075,
            "source_unit": "KRW",
            "normalized_value": 5662.989,
            "normalized_unit": "KRW_MILLION",
            "normalization_factor": 1e-06,
            "account_name": "X. 당기순이익(주석24)",
            "receipt_number": "20260408002280",
            "extraction_method": "audit_report_xml_acode",
            "verification_status": "extracted",
            "fiscal_year": 2025,
            "reporting_scope": "separate",
            "source_ids": [
              "dart-00144960-20260408002280"
            ],
            "confidence": "high"
          },
          "operating_cash_flow": {
            "source_value": -30830315410,
            "source_unit": "KRW",
            "normalized_value": -30830.315,
            "normalized_unit": "KRW_MILLION",
            "normalization_factor": 1e-06,
            "account_name": "Ⅰ. 영업활동으로 인한 현금흐름",
            "receipt_number": "20260408002280",
            "extraction_method": "audit_report_xml_acode",
            "verification_status": "extracted",
            "fiscal_year": 2025,
            "reporting_scope": "separate",
            "source_ids": [
              "dart-00144960-20260408002280"
            ],
            "confidence": "high"
          }